{
  "report_id": "rs-extract-rs-intake-second-run-001",
  "packet_id": "rs-intake-second-run-001",
  "source_url": "https://www.youtube.com/watch?v=dTyY6rft5kg",
  "created_at": "2025-03-20T12:00:00Z",
  "summary": "The video tutorial demonstrates how to use the Polymarket API with Python to place bets and fetch market data. It emphasizes the ease of use for those with minimal Python experience and provides guidance on authentication and executing trades. By the end, viewers will understand how to automate trade placements and track positions.",
  "methods_tools_patterns": [
    {
      "name": "Polymarket API",
      "description": "The API allows users to place bets, fetch market data, and retrieve user activity on Polymarket.",
      "evidence": "Poly Market, the betting platform, has just become the biggest prediction market in the world with millions of dollars of volume every single day.",
      "category": "tool"
    },
    {
      "name": "Python Requests Library",
      "description": "Used for making HTTP requests to the Polymarket API to fetch data and place orders.",
      "evidence": "we are directly requesting the API of poly market",
      "category": "tool"
    },
    {
      "name": "Order Management Functions",
      "description": "Functions created to handle placing, cancelling, and tracking open orders.",
      "evidence": "there’s a lot of methods you can use up to you to go check",
      "category": "pattern"
    }
  ],
  "key_claims": [
    {
      "claim": "The tutorial enables users to place real bets on Polymarket with minimal coding experience.",
      "evidence": "even if you don't know much about Python, it'll be super easy.",
      "confidence": "stated"
    },
    {
      "claim": "Polymarket has a comprehensive API for fetching and managing market data.",
      "evidence": "this is public knowledge if you want. So you don't need to authenticate to do that.",
      "confidence": "stated"
    },
    {
      "claim": "Users can automate trading and track user positions using the provided tools.",
      "evidence": "price tracking, little automation there, and a position tracker of other users.",
      "confidence": "inferred"
    }
  ],
  "hype_signals": [
    "biggest prediction market in the world",
    "everything is open source and free",
    "super easy"
  ],
  "open_questions": [
    "What additional safeguards are in place to protect users' private API keys?",
    "How does Polymarket ensure the reliability and security of its API?",
    "What are the long-term implications of using third-party libraries like the one mentioned?"
  ]
}