{
  "report_id": "rs-extract-rs-acq-20260321-60b679f7",
  "packet_id": "rs-acq-20260321-60b679f7",
  "source_url": "https://github.com/python/cpython",
  "created_at": "2023-10-03T12:00:00Z",
  "summary": "Python version 3.15.0 alpha 7 is now available. This release includes build instructions, testing methods, and detailed documentation on new features and changes. The developers emphasize the importance of profile-guided optimization (PGO) and link-time optimization (LTO) for performance improvements.",
  "methods_tools_patterns": [
    {
      "name": "Profile Guided Optimization",
      "description": "PGO utilizes GCC or Clang to optimize the build process through profiling information.",
      "evidence": "PGO takes advantage of recent versions of the GCC or Clang compilers.",
      "category": "pattern"
    },
    {
      "name": "Link Time Optimization",
      "description": "LTO enables optimization across file boundaries for better performance.",
      "evidence": "LTO takes advantage of the ability of recent compiler toolchains to optimize across the otherwise arbitrary `.o` file boundary.",
      "category": "pattern"
    }
  ],
  "key_claims": [
    {
      "claim": "Python 3.15.0 alpha 7 introduces several new features and optimizations.",
      "evidence": "We have a comprehensive overview of the changes in the `What's new in Python 3.15` document.",
      "confidence": "stated"
    },
    {
      "claim": "Documentation is regularly updated and available in multiple formats.",
      "evidence": "Documentation for Python 3.15 is online, updated daily.",
      "confidence": "stated"
    }
  ],
  "hype_signals": [
    "optimized build process will perform the following steps",
    "Python binary that is optimized; suitable for distribution or production installation"
  ],
  "open_questions": [
    "What specific new features are included in this alpha release?",
    "Are there additional dependencies required for various Linux distributions that are not explicitly mentioned?"
  ]
}