{
  "report_id": "rs-extract-rs-acq-20260321-32d1d04f",
  "packet_id": "rs-acq-20260321-32d1d04f",
  "source_url": "https://github.com/python/cpython",
  "created_at": "2025-03-20T12:00:00Z",
  "summary": "This document provides a comprehensive overview of Python version 3.15.0 alpha 7, including build instructions, contributing guidelines, and testing procedures. It also highlights the installation of multiple versions and links to the documentation for further details.",
  "methods_tools_patterns": [
    {
      "name": "Build Instructions",
      "description": "Instructions on how to configure and install Python, with platform-specific notes.",
      "evidence": "On Unix, Linux, BSD, macOS, and Cygwin:: ./configure make make test sudo make install",
      "category": "pattern"
    },
    {
      "name": "Profile Guided Optimization",
      "description": "Optimizes the build process by using profiling information to enhance performance.",
      "evidence": "The optimized build process will perform the following steps: ... The end result will be a Python binary that is optimized; suitable for distribution or production installation.",
      "category": "method"
    },
    {
      "name": "Link Time Optimization",
      "description": "Utilizes optimization across object file boundaries to improve performance.",
      "evidence": "LTO takes advantage of the ability of recent compiler toolchains to optimize across the otherwise arbitrary .o file boundary when building final executables or shared libraries for additional performance gains.",
      "category": "method"
    }
  ],
  "key_claims": [
    {
      "claim": "Python can be installed side-by-side with other versions.",
      "evidence": "If you intend to install multiple versions using the same prefix you must decide which version ... Install all other versions using make altinstall.",
      "confidence": "stated"
    },
    {
      "claim": "Optimizing build performance significantly benefits from additional compiler flags.",
      "evidence": "This sets the default make targets up to enable Profile Guided Optimization (PGO) and may be used to auto-enable Link Time Optimization (LTO) on some platforms.",
      "confidence": "stated"
    },
    {
      "claim": "The testing process can highlight potential issues in the Python build.",
      "evidence": "If a message is printed about a failed test ... something is wrong.",
      "confidence": "inferred"
    }
  ],
  "hype_signals": [
    "suitable for distribution or production installation",
    "optimized build process",
    "additional performance gains"
  ],
  "open_questions": [
    "What specific third-party libraries are required for complete installation?",
    "Are there any known issues with the current alpha version?",
    "What are the specific benefits of using the new features in Python 3.15?"
  ]
}