{
  "report_id": "rs-extract-rs-intake-first-run-001",
  "packet_id": "rs-intake-first-run-001",
  "source_url": "https://www.youtube.com/watch?v=i3ZlLmYn584",
  "created_at": "2023-10-20T12:00:00Z",
  "summary": "This video demonstrates how to build a Polymarket trading bot using OpenClaw, illustrating the step-by-step process and insights gained during its development. The creator details their interactions with an AI agent named Max to optimize trading strategies and discusses initial successes and learning experiences encountered along the way.",
  "methods_tools_patterns": [
    {
      "name": "OpenClaw",
      "description": "AI agent used to develop and operate the Polymarket trading bot.",
      "evidence": "So, that being said, let's let's get started with literally the first prompt that I used on this exact project, which was...",
      "category": "tool"
    },
    {
      "name": "Trading Strategies",
      "description": "Various strategies employed for trading, including market analysis and exploiting arbitrage opportunities.",
      "evidence": "Buy up cheap before odds adjust. Chain link catches up. You win.",
      "category": "method"
    },
    {
      "name": "Versioning Approach",
      "description": "Iterative improvement of the trading bot through version releases based on performance.",
      "evidence": "There was a V1, there was a V2 and yesterday it managed to lose five trades consecutively...",
      "category": "pattern"
    }
  ],
  "key_claims": [
    {
      "claim": "The bot can autonomously generate profits from trading.",
      "evidence": "you just wake up and it's made you $15 in your sleep.",
      "confidence": "inferred"
    },
    {
      "claim": "Exploiting price lag between Binance and Chainlink can enhance profitability.",
      "evidence": "the real edge is exploiting the lag between Binance and chain link...",
      "confidence": "stated"
    },
    {
      "claim": "The bot undergoes a testing and validation phase before scaling.",
      "evidence": "my recommendation phase one, let's validate. Let's spend this week on validation.",
      "confidence": "stated"
    }
  ],
  "hype_signals": [
    "We're truly living in the future.",
    "This is quite literally how I built the bot.",
    "you just wake up and it's made you $15 in your sleep."
  ],
  "open_questions": [
    "What specific adjustments were made to improve the bot after it experienced losses?",
    "Are there any particular risks associated with the arbitrage strategy mentioned?",
    "What are the exact limitations of using OpenClaw for trading bot development?"
  ]
}